{
  "schemaVersion": 2,
  "rubric": "quality-v2",
  "artifactSha256": "2a436d7c54b4219f3e2fde47e86edcab50179cd6f665dad853dbc71ba835ae4e",
  "capture": {
    "protocol": "browser-runtime-v2",
    "capturedAt": "2026-09-03T04:26:32.526Z",
    "viewport": {
      "width": 1440,
      "height": 900
    },
    "observationMs": 11020,
    "runtime": {
      "loads": true,
      "canvasCount": 1,
      "viewportFit": false,
      "pageErrors": [],
      "consoleErrors": [
        "Failed to load resource: the server responded with a status of 404 (Not Found)"
      ],
      "failedRequests": [],
      "document": {
        "width": 1440,
        "height": 917
      }
    },
    "motion": {
      "automaticChangePct": 0.2,
      "interactionChangePct": 2.7,
      "sustainedIntervals": 2,
      "sampledIntervals": 2
    },
    "samples": [
      {
        "id": "initial",
        "atMs": 875,
        "imageSha256": "dd18df06644db5007431c2ba05b38787ffe5f57802de7b8f335b6137e8020436",
        "nonBlankPct": 74.8
      },
      {
        "id": "auto-1",
        "atMs": 3847,
        "imageSha256": "99cf385b5b86c3b8a18b60f025f83167f075cc2486faeea72f9637a494c5d6de",
        "nonBlankPct": 74.7
      },
      {
        "id": "auto-2",
        "atMs": 6718,
        "imageSha256": "3796d9ed8a4b887652c90b83be4cfef8a46ce39e5a04c166c27f74331cbee0c5",
        "nonBlankPct": 74.5
      },
      {
        "id": "interaction",
        "atMs": 9604,
        "imageSha256": "511b7fdde34a574a33b7c417775a73c031969ab4e373650520db9035ec2d2030",
        "nonBlankPct": 75.3
      }
    ],
    "evidence": [
      "HTTP 200; 1 canvas element(s).",
      "Automatic pixel change 0.2% across 2 intervals.",
      "Interaction control:Begin the night changed 2.7% of sampled pixels.",
      "Document 1440x917 at viewport 1440x900."
    ]
  },
  "task": {
    "checks": {
      "loads": true,
      "coreExperience": false,
      "expectedBehavior": false,
      "runtimeStability": true,
      "viewportFit": false
    },
    "evidence": [
      "HTTP 200; 1 canvas element(s).",
      "Automatic pixel change 0.2% across 2 intervals.",
      "Interaction control:Begin the night changed 2.7% of sampled pixels.",
      "Document 1440x917 at viewport 1440x900.",
      "Failed checks: coreExperience, expectedBehavior, viewportFit.",
      "The landing state changed after interaction but no fireworks display appeared."
    ]
  },
  "experienceReviews": [
    {
      "reviewer": {
        "id": "codex-multimodal-quality-v2-2026-09-03",
        "type": "multimodal-model"
      },
      "blind": true,
      "reviewedAt": "2026-09-03T18:30:00.000Z",
      "cohortId": "current::fireworks::C::prompt-r1",
      "candidateCount": 13,
      "placement": 12,
      "facets": {
        "clarity": 0,
        "motionInteraction": 1,
        "composition": 0,
        "craft": 0
      },
      "evidence": [
        "Placed 12 of 13 after comparing initial, automatic, and interaction samples in the same benchmark and level.",
        "Automatic pixel change 0.2%; interaction change 2.7%."
      ],
      "limitations": [
        "Single provisional multimodal review; independent human confirmation is still required.",
        "Pixel change describes motion magnitude, not motion quality."
      ]
    }
  ]
}
