{
  "schemaVersion": 2,
  "rubric": "quality-v2",
  "artifactSha256": "e52a58fe29de09b0cc7e3743df48f148f9238082330eccf9565eb5a1d947a3d8",
  "capture": {
    "protocol": "browser-runtime-v2",
    "capturedAt": "2026-09-03T04:24:06.493Z",
    "viewport": {
      "width": 1440,
      "height": 900
    },
    "observationMs": 9706,
    "runtime": {
      "loads": true,
      "canvasCount": 2,
      "viewportFit": true,
      "pageErrors": [],
      "consoleErrors": [],
      "failedRequests": [],
      "document": {
        "width": 1440,
        "height": 900
      }
    },
    "motion": {
      "automaticChangePct": 1.2,
      "interactionChangePct": 1.2,
      "sustainedIntervals": 2,
      "sampledIntervals": 2
    },
    "samples": [
      {
        "id": "initial",
        "atMs": 974,
        "imageSha256": "64875da13e18063754d5ee193117e9d80a86f7f2e0cb0d10326c9b495d77837a",
        "nonBlankPct": 99.9
      },
      {
        "id": "auto-1",
        "atMs": 3551,
        "imageSha256": "756d7a3c215126eba3111799ab7a839bc6ba08511622545b60bb9ad2d8e40e0d",
        "nonBlankPct": 100
      },
      {
        "id": "auto-2",
        "atMs": 5906,
        "imageSha256": "50b34693697b612693494b8d77b5e383fa6b5b1920511938be767b0726d81d20",
        "nonBlankPct": 100
      },
      {
        "id": "interaction",
        "atMs": 8197,
        "imageSha256": "c039df7ce81d869fd34f442280447b5f7ed13f5f37c058e16e021f66399c7032",
        "nonBlankPct": 100
      }
    ],
    "evidence": [
      "HTTP 200; 2 canvas element(s).",
      "Automatic pixel change 1.2% across 2 intervals.",
      "Interaction viewport-center changed 1.2% of sampled pixels.",
      "Document 1440x900 at viewport 1440x900."
    ]
  },
  "task": {
    "checks": {
      "loads": true,
      "coreExperience": true,
      "expectedBehavior": true,
      "runtimeStability": true,
      "viewportFit": true
    },
    "evidence": [
      "HTTP 200; 2 canvas element(s).",
      "Automatic pixel change 1.2% across 2 intervals.",
      "Interaction viewport-center changed 1.2% of sampled pixels.",
      "Document 1440x900 at viewport 1440x900.",
      "All five observable task checks passed."
    ]
  },
  "experienceReviews": [
    {
      "reviewer": {
        "id": "codex-multimodal-quality-v2-2026-09-03",
        "type": "multimodal-model"
      },
      "blind": true,
      "reviewedAt": "2026-09-03T18:30:00.000Z",
      "cohortId": "current::ant-colony::B::prompt-r1",
      "candidateCount": 14,
      "placement": 5,
      "facets": {
        "clarity": 3,
        "motionInteraction": 3,
        "composition": 3,
        "craft": 3
      },
      "evidence": [
        "Placed 5 of 14 after comparing initial, automatic, and interaction samples in the same benchmark and level.",
        "Automatic pixel change 1.2%; interaction change 1.2%."
      ],
      "limitations": [
        "Single provisional multimodal review; independent human confirmation is still required.",
        "Pixel change describes motion magnitude, not motion quality."
      ]
    }
  ]
}
