{
  "schemaVersion": 2,
  "rubric": "quality-v2",
  "artifactSha256": "835dfb0b0784fa9a6a1682c3794ab77d5776ee8c46cf0f69b96429678917a636",
  "capture": {
    "protocol": "browser-runtime-v2",
    "capturedAt": "2026-09-03T04:23:13.651Z",
    "viewport": {
      "width": 1440,
      "height": 900
    },
    "observationMs": 14966,
    "runtime": {
      "loads": true,
      "canvasCount": 1,
      "viewportFit": true,
      "pageErrors": [],
      "consoleErrors": [],
      "failedRequests": [],
      "document": {
        "width": 1440,
        "height": 900
      }
    },
    "motion": {
      "automaticChangePct": 26.8,
      "interactionChangePct": 55,
      "sustainedIntervals": 2,
      "sampledIntervals": 2
    },
    "samples": [
      {
        "id": "initial",
        "atMs": 4574,
        "imageSha256": "2d477da5273f1bfa091c6d0843e2536b9378ba6f0b499dc008050461e7586414",
        "nonBlankPct": 95.2
      },
      {
        "id": "auto-1",
        "atMs": 6550,
        "imageSha256": "ad9a66bccb220ca6555857c47ee755ede065f062897c0b1692b29adadc89b13b",
        "nonBlankPct": 95.1
      },
      {
        "id": "auto-2",
        "atMs": 9104,
        "imageSha256": "10ef77a36649e87ff933f21b309ea53d2b605cb4625a002e3eae7de9261df88a",
        "nonBlankPct": 95.2
      },
      {
        "id": "interaction",
        "atMs": 12402,
        "imageSha256": "72b34fff70a40255c8e385a299eb4af386cd0a766d7b8b3eb9072876f54105fb",
        "nonBlankPct": 94.5
      }
    ],
    "evidence": [
      "HTTP 200; 1 canvas element(s).",
      "Automatic pixel change 26.8% across 2 intervals.",
      "Interaction viewport-center changed 55% of sampled pixels.",
      "Document 1440x900 at viewport 1440x900."
    ]
  },
  "task": {
    "checks": {
      "loads": true,
      "coreExperience": true,
      "expectedBehavior": false,
      "runtimeStability": true,
      "viewportFit": true
    },
    "evidence": [
      "HTTP 200; 1 canvas element(s).",
      "Automatic pixel change 26.8% across 2 intervals.",
      "Interaction viewport-center changed 55% of sampled pixels.",
      "Document 1440x900 at viewport 1440x900.",
      "Failed checks: expectedBehavior.",
      "The moving scene is framed behind a visible vehicle instead of a first-person ride."
    ]
  },
  "experienceReviews": [
    {
      "reviewer": {
        "id": "codex-multimodal-quality-v2-2026-09-03",
        "type": "multimodal-model"
      },
      "blind": true,
      "reviewedAt": "2026-09-03T18:30:00.000Z",
      "cohortId": "current::rollercoaster::A::prompt-r1",
      "candidateCount": 27,
      "placement": 24,
      "facets": {
        "clarity": 0,
        "motionInteraction": 1,
        "composition": 0,
        "craft": 0
      },
      "evidence": [
        "Placed 24 of 27 after comparing initial, automatic, and interaction samples in the same benchmark and level.",
        "Automatic pixel change 26.8%; interaction change 55%."
      ],
      "limitations": [
        "Single provisional multimodal review; independent human confirmation is still required.",
        "Pixel change describes motion magnitude, not motion quality."
      ]
    }
  ]
}
