{
  "schemaVersion": 2,
  "rubric": "quality-v2",
  "artifactSha256": "219177caaa56b7c49d54b7af818a5c0a7adf69b36515d3bf8ba8f607b4f424e2",
  "capture": {
    "protocol": "browser-runtime-v2",
    "capturedAt": "2026-09-03T04:25:50.405Z",
    "viewport": {
      "width": 1440,
      "height": 900
    },
    "observationMs": 13327,
    "runtime": {
      "loads": true,
      "canvasCount": 1,
      "viewportFit": true,
      "pageErrors": [],
      "consoleErrors": [],
      "failedRequests": [],
      "document": {
        "width": 1440,
        "height": 900
      }
    },
    "motion": {
      "automaticChangePct": 0.9,
      "interactionChangePct": 1.5,
      "sustainedIntervals": 2,
      "sampledIntervals": 2
    },
    "samples": [
      {
        "id": "initial",
        "atMs": 775,
        "imageSha256": "a19e63c84d631dc212f647e1a8d65633701379cc7ce3b5b64491f581a8b9e27c",
        "nonBlankPct": 92.2
      },
      {
        "id": "auto-1",
        "atMs": 4531,
        "imageSha256": "ebcfadb7640fc1a1a38e4fb62443e6c534ef3d1367f20df46e322e157c89a5ad",
        "nonBlankPct": 92.2
      },
      {
        "id": "auto-2",
        "atMs": 8143,
        "imageSha256": "8af37c02a5c21474d49687e1e2673ecc799c46b91cf7c6b7846e8a4acd035bf3",
        "nonBlankPct": 92.2
      },
      {
        "id": "interaction",
        "atMs": 11151,
        "imageSha256": "9e0b4fb4980c4d54ca89d144d8ade59500668fab9399c5c2c553966ea9f80f1c",
        "nonBlankPct": 92.2
      }
    ],
    "evidence": [
      "HTTP 200; 1 canvas element(s).",
      "Automatic pixel change 0.9% across 2 intervals.",
      "Interaction control:Launch one changed 1.5% of sampled pixels.",
      "Document 1440x900 at viewport 1440x900."
    ]
  },
  "task": {
    "checks": {
      "loads": true,
      "coreExperience": true,
      "expectedBehavior": true,
      "runtimeStability": true,
      "viewportFit": true
    },
    "evidence": [
      "HTTP 200; 1 canvas element(s).",
      "Automatic pixel change 0.9% across 2 intervals.",
      "Interaction control:Launch one changed 1.5% of sampled pixels.",
      "Document 1440x900 at viewport 1440x900.",
      "All five observable task checks passed."
    ]
  },
  "experienceReviews": [
    {
      "reviewer": {
        "id": "codex-multimodal-quality-v2-2026-09-03",
        "type": "multimodal-model"
      },
      "blind": true,
      "reviewedAt": "2026-09-03T18:30:00.000Z",
      "cohortId": "current::fireworks::B::prompt-r1",
      "candidateCount": 13,
      "placement": 4,
      "facets": {
        "clarity": 3,
        "motionInteraction": 3,
        "composition": 3,
        "craft": 3
      },
      "evidence": [
        "Placed 4 of 13 after comparing initial, automatic, and interaction samples in the same benchmark and level.",
        "Automatic pixel change 0.9%; interaction change 1.5%."
      ],
      "limitations": [
        "Single provisional multimodal review; independent human confirmation is still required.",
        "Pixel change describes motion magnitude, not motion quality."
      ]
    }
  ]
}
