{
  "schemaVersion": 2,
  "rubric": "quality-v2",
  "artifactSha256": "65ad91ed89def5145dcf08d4f1922685781cde5a2e045550cc5627dd22985c76",
  "capture": {
    "protocol": "browser-runtime-v2",
    "capturedAt": "2026-09-03T04:24:06.800Z",
    "viewport": {
      "width": 1440,
      "height": 900
    },
    "observationMs": 9939,
    "runtime": {
      "loads": true,
      "canvasCount": 3,
      "viewportFit": true,
      "pageErrors": [],
      "consoleErrors": [],
      "failedRequests": [],
      "document": {
        "width": 1440,
        "height": 900
      }
    },
    "motion": {
      "automaticChangePct": 2.3,
      "interactionChangePct": 3,
      "sustainedIntervals": 2,
      "sampledIntervals": 2
    },
    "samples": [
      {
        "id": "initial",
        "atMs": 1174,
        "imageSha256": "2c166856641cd2b67b410d0689915c86a6f453ec566ccc16c3747d0a7f9d917c",
        "nonBlankPct": 95.7
      },
      {
        "id": "auto-1",
        "atMs": 3602,
        "imageSha256": "6b1bde2d3fa1d6c86c15d4bec9c245de791e40a4de5a4843d0e9b7cedafd7d63",
        "nonBlankPct": 95.6
      },
      {
        "id": "auto-2",
        "atMs": 5932,
        "imageSha256": "2d77f13a1da1614108446191c3ed9319c63c272942028aafcebadea210f69e75",
        "nonBlankPct": 94.3
      },
      {
        "id": "interaction",
        "atMs": 8123,
        "imageSha256": "f20af351dde9a1f29cd5cb56b031256608c70e8721c90ec59d48a7111a43dedf",
        "nonBlankPct": 94.3
      }
    ],
    "evidence": [
      "HTTP 200; 3 canvas element(s).",
      "Automatic pixel change 2.3% across 2 intervals.",
      "Interaction viewport-center changed 3% of sampled pixels.",
      "Document 1440x900 at viewport 1440x900."
    ]
  },
  "task": {
    "checks": {
      "loads": true,
      "coreExperience": true,
      "expectedBehavior": true,
      "runtimeStability": true,
      "viewportFit": true
    },
    "evidence": [
      "HTTP 200; 3 canvas element(s).",
      "Automatic pixel change 2.3% across 2 intervals.",
      "Interaction viewport-center changed 3% of sampled pixels.",
      "Document 1440x900 at viewport 1440x900.",
      "All five observable task checks passed."
    ]
  },
  "experienceReviews": [
    {
      "reviewer": {
        "id": "codex-multimodal-quality-v2-2026-09-03",
        "type": "multimodal-model"
      },
      "blind": true,
      "reviewedAt": "2026-09-03T18:30:00.000Z",
      "cohortId": "current::ant-colony::C::prompt-r1",
      "candidateCount": 13,
      "placement": 8,
      "facets": {
        "clarity": 2,
        "motionInteraction": 2,
        "composition": 2,
        "craft": 2
      },
      "evidence": [
        "Placed 8 of 13 after comparing initial, automatic, and interaction samples in the same benchmark and level.",
        "Automatic pixel change 2.3%; interaction change 3%."
      ],
      "limitations": [
        "Single provisional multimodal review; independent human confirmation is still required.",
        "Pixel change describes motion magnitude, not motion quality."
      ]
    }
  ]
}
