{
  "schemaVersion": 2,
  "rubric": "quality-v2",
  "artifactSha256": "fd8209dc6b53f458ce69163a216f17056975db4c727c0501b89359aa7dc28690",
  "capture": {
    "protocol": "browser-runtime-v2",
    "capturedAt": "2026-09-03T04:24:07.029Z",
    "viewport": {
      "width": 1440,
      "height": 900
    },
    "observationMs": 9025,
    "runtime": {
      "loads": true,
      "canvasCount": 1,
      "viewportFit": true,
      "pageErrors": [],
      "consoleErrors": [
        "Failed to load resource: the server responded with a status of 404 (Not Found)"
      ],
      "failedRequests": [],
      "document": {
        "width": 1440,
        "height": 900
      }
    },
    "motion": {
      "automaticChangePct": 0.7,
      "interactionChangePct": 1.6,
      "sustainedIntervals": 2,
      "sampledIntervals": 2
    },
    "samples": [
      {
        "id": "initial",
        "atMs": 806,
        "imageSha256": "3770d740f9cb1c17677493642e2dbbe7ab6f1de2ba9d2efd8ba586f60dd5bfe4",
        "nonBlankPct": 13.4
      },
      {
        "id": "auto-1",
        "atMs": 2896,
        "imageSha256": "6d50ed28eecae448de8b4f6c9e689a6fa09800e19d0ef6c4c9dda951cd9c8e89",
        "nonBlankPct": 13
      },
      {
        "id": "auto-2",
        "atMs": 5028,
        "imageSha256": "46d7121a1810ad1d1105afc4d62a80047059b13af6e377f92056ad44912a75ab",
        "nonBlankPct": 12.4
      },
      {
        "id": "interaction",
        "atMs": 6980,
        "imageSha256": "a19f602f519f2e7723cfd6a87b8b5deeb2916b71044bb4276a5c7f8cf0f59709",
        "nonBlankPct": 13
      }
    ],
    "evidence": [
      "HTTP 200; 1 canvas element(s).",
      "Automatic pixel change 0.7% across 2 intervals.",
      "Interaction viewport-center changed 1.6% of sampled pixels.",
      "Document 1440x900 at viewport 1440x900."
    ]
  },
  "task": {
    "checks": {
      "loads": true,
      "coreExperience": true,
      "expectedBehavior": true,
      "runtimeStability": true,
      "viewportFit": true
    },
    "evidence": [
      "HTTP 200; 1 canvas element(s).",
      "Automatic pixel change 0.7% across 2 intervals.",
      "Interaction viewport-center changed 1.6% of sampled pixels.",
      "Document 1440x900 at viewport 1440x900.",
      "All five observable task checks passed."
    ]
  },
  "experienceReviews": [
    {
      "reviewer": {
        "id": "codex-multimodal-quality-v2-2026-09-03",
        "type": "multimodal-model"
      },
      "blind": true,
      "reviewedAt": "2026-09-03T18:30:00.000Z",
      "cohortId": "current::fireworks::A::prompt-r1",
      "candidateCount": 14,
      "placement": 7,
      "facets": {
        "clarity": 2,
        "motionInteraction": 2,
        "composition": 2,
        "craft": 2
      },
      "evidence": [
        "Placed 7 of 14 after comparing initial, automatic, and interaction samples in the same benchmark and level.",
        "Automatic pixel change 0.7%; interaction change 1.6%."
      ],
      "limitations": [
        "Single provisional multimodal review; independent human confirmation is still required.",
        "Pixel change describes motion magnitude, not motion quality."
      ]
    }
  ]
}
