{
  "schemaVersion": 2,
  "rubric": "quality-v2",
  "artifactSha256": "3aac196864cb3146f5b7a355d33a19ee5e52aa4171d15857f74c9c8519bef61a",
  "capture": {
    "protocol": "browser-runtime-v2",
    "capturedAt": "2026-09-03T04:25:05.895Z",
    "viewport": {
      "width": 1440,
      "height": 900
    },
    "observationMs": 15241,
    "runtime": {
      "loads": true,
      "canvasCount": 1,
      "viewportFit": true,
      "pageErrors": [],
      "consoleErrors": [],
      "failedRequests": [],
      "document": {
        "width": 1440,
        "height": 900
      }
    },
    "motion": {
      "automaticChangePct": 0.1,
      "interactionChangePct": 0.2,
      "sustainedIntervals": 0,
      "sampledIntervals": 2
    },
    "samples": [
      {
        "id": "initial",
        "atMs": 843,
        "imageSha256": "28769c7b180d253ed9e67e6d4aa080fa88c7b10ed0d3602d903f990512c4ea61",
        "nonBlankPct": 100
      },
      {
        "id": "auto-1",
        "atMs": 5107,
        "imageSha256": "7685ac2cc994b566dd389416ce2cc80c708d6ad01b6bfba47ef389cdca5a1707",
        "nonBlankPct": 100
      },
      {
        "id": "auto-2",
        "atMs": 9026,
        "imageSha256": "3849e541b6dcafa6f7ac3094377a4094532baaed9c7a4f1c83b093a62760dc68",
        "nonBlankPct": 100
      },
      {
        "id": "interaction",
        "atMs": 13819,
        "imageSha256": "87887a0c286d7560a83d9113669e803906421d3d013b66890f00d3230bd7da80",
        "nonBlankPct": 100
      }
    ],
    "evidence": [
      "HTTP 200; 1 canvas element(s).",
      "Automatic pixel change 0.1% across 2 intervals.",
      "Interaction control:Launch a firework ↗ changed 0.2% of sampled pixels.",
      "Document 1440x900 at viewport 1440x900."
    ]
  },
  "task": {
    "checks": {
      "loads": true,
      "coreExperience": false,
      "expectedBehavior": false,
      "runtimeStability": true,
      "viewportFit": true
    },
    "evidence": [
      "HTTP 200; 1 canvas element(s).",
      "Automatic pixel change 0.1% across 2 intervals.",
      "Interaction control:Launch a firework ↗ changed 0.2% of sampled pixels.",
      "Document 1440x900 at viewport 1440x900.",
      "Failed checks: coreExperience, expectedBehavior.",
      "No visible fireworks appeared during the automatic or interaction samples."
    ]
  },
  "experienceReviews": [
    {
      "reviewer": {
        "id": "codex-multimodal-quality-v2-2026-09-03",
        "type": "multimodal-model"
      },
      "blind": true,
      "reviewedAt": "2026-09-03T18:30:00.000Z",
      "cohortId": "current::fireworks::B::prompt-r1",
      "candidateCount": 13,
      "placement": 10,
      "facets": {
        "clarity": 1,
        "motionInteraction": 1,
        "composition": 1,
        "craft": 1
      },
      "evidence": [
        "Placed 10 of 13 after comparing initial, automatic, and interaction samples in the same benchmark and level.",
        "Automatic pixel change 0.1%; interaction change 0.2%."
      ],
      "limitations": [
        "Single provisional multimodal review; independent human confirmation is still required.",
        "Pixel change describes motion magnitude, not motion quality."
      ]
    }
  ]
}
