{
  "schemaVersion": 2,
  "rubric": "quality-v2",
  "artifactSha256": "79ec98e3de0e5d883a71824a4b3b08d1a0b77723860869839005bdd1c4f1b0fe",
  "capture": {
    "protocol": "browser-runtime-v2",
    "capturedAt": "2026-09-03T04:24:51.374Z",
    "viewport": {
      "width": 1440,
      "height": 900
    },
    "observationMs": 13349,
    "runtime": {
      "loads": true,
      "canvasCount": 1,
      "viewportFit": true,
      "pageErrors": [],
      "consoleErrors": [
        "Failed to load resource: the server responded with a status of 404 (Not Found)"
      ],
      "failedRequests": [],
      "document": {
        "width": 1440,
        "height": 900
      }
    },
    "motion": {
      "automaticChangePct": 1.7,
      "interactionChangePct": 90,
      "sustainedIntervals": 2,
      "sampledIntervals": 2
    },
    "samples": [
      {
        "id": "initial",
        "atMs": 876,
        "imageSha256": "94f71581cd83023576a31029ea3c724aac27da72af5ab3c46189aabdedbb70bd",
        "nonBlankPct": 100
      },
      {
        "id": "auto-1",
        "atMs": 5412,
        "imageSha256": "4ee479f9f2f741f8c6912d9f03d9d2f33d4a7e02bfc21c1a12e7d19f4ad0677b",
        "nonBlankPct": 100
      },
      {
        "id": "auto-2",
        "atMs": 8281,
        "imageSha256": "1885a893dc1d833c767000826c7eb5a56d351f9e8d86951b2dc9529fd675bbd8",
        "nonBlankPct": 100
      },
      {
        "id": "interaction",
        "atMs": 11897,
        "imageSha256": "4360e937f45afbd194921a773d86119b1cbe503ed39bcc31dac38cafc2ab9146",
        "nonBlankPct": 44.7
      }
    ],
    "evidence": [
      "HTTP 200; 1 canvas element(s).",
      "Automatic pixel change 1.7% across 2 intervals.",
      "Interaction control:Begin ride changed 90% of sampled pixels.",
      "Document 1440x900 at viewport 1440x900."
    ]
  },
  "task": {
    "checks": {
      "loads": true,
      "coreExperience": true,
      "expectedBehavior": true,
      "runtimeStability": true,
      "viewportFit": true
    },
    "evidence": [
      "HTTP 200; 1 canvas element(s).",
      "Automatic pixel change 1.7% across 2 intervals.",
      "Interaction control:Begin ride changed 90% of sampled pixels.",
      "Document 1440x900 at viewport 1440x900.",
      "All five observable task checks passed."
    ]
  },
  "experienceReviews": [
    {
      "reviewer": {
        "id": "codex-multimodal-quality-v2-2026-09-03",
        "type": "multimodal-model"
      },
      "blind": true,
      "reviewedAt": "2026-09-03T18:30:00.000Z",
      "cohortId": "current::rollercoaster::B::prompt-r1",
      "candidateCount": 20,
      "placement": 10,
      "facets": {
        "clarity": 2,
        "motionInteraction": 3,
        "composition": 2,
        "craft": 2
      },
      "evidence": [
        "Placed 10 of 20 after comparing initial, automatic, and interaction samples in the same benchmark and level.",
        "Automatic pixel change 1.7%; interaction change 90%."
      ],
      "limitations": [
        "Single provisional multimodal review; independent human confirmation is still required.",
        "Pixel change describes motion magnitude, not motion quality."
      ]
    }
  ]
}
