{
  "schemaVersion": 2,
  "rubric": "quality-v2",
  "artifactSha256": "ae9137454fd03b93785dd276af4b181ea95291a1e7a7fa0ed16ff984e82bd796",
  "capture": {
    "protocol": "browser-runtime-v2",
    "capturedAt": "2026-09-03T04:24:35.392Z",
    "viewport": {
      "width": 1440,
      "height": 900
    },
    "observationMs": 14655,
    "runtime": {
      "loads": true,
      "canvasCount": 1,
      "viewportFit": true,
      "pageErrors": [],
      "consoleErrors": [],
      "failedRequests": [],
      "document": {
        "width": 1440,
        "height": 900
      }
    },
    "motion": {
      "automaticChangePct": 70,
      "interactionChangePct": 50.7,
      "sustainedIntervals": 2,
      "sampledIntervals": 2
    },
    "samples": [
      {
        "id": "initial",
        "atMs": 5289,
        "imageSha256": "983fc9140e1b27135f4cf5bbe4579f7c129e5689249943f7db200809e0a6cb31",
        "nonBlankPct": 97.8
      },
      {
        "id": "auto-1",
        "atMs": 7388,
        "imageSha256": "3a7df7e5de210fdbfdbb63c596c9b9202f35c46faf4010b089aca4f5959cc60b",
        "nonBlankPct": 99.7
      },
      {
        "id": "auto-2",
        "atMs": 9795,
        "imageSha256": "4fc4b7c5db9c48cb5222d3e184b698657dd76548caa3c56c5ee35dd40fa1ea15",
        "nonBlankPct": 99.8
      },
      {
        "id": "interaction",
        "atMs": 11931,
        "imageSha256": "5330ffddc00c99aceb970eca7177931b3beb8a896caf01def7e474ad6776369e",
        "nonBlankPct": 99.7
      }
    ],
    "evidence": [
      "HTTP 200; 1 canvas element(s).",
      "Automatic pixel change 70% across 2 intervals.",
      "Interaction viewport-center changed 50.7% of sampled pixels.",
      "Document 1440x900 at viewport 1440x900."
    ]
  },
  "task": {
    "checks": {
      "loads": true,
      "coreExperience": true,
      "expectedBehavior": true,
      "runtimeStability": true,
      "viewportFit": true
    },
    "evidence": [
      "HTTP 200; 1 canvas element(s).",
      "Automatic pixel change 70% across 2 intervals.",
      "Interaction viewport-center changed 50.7% of sampled pixels.",
      "Document 1440x900 at viewport 1440x900.",
      "All five observable task checks passed."
    ]
  },
  "experienceReviews": [
    {
      "reviewer": {
        "id": "codex-multimodal-quality-v2-2026-09-03",
        "type": "multimodal-model"
      },
      "blind": true,
      "reviewedAt": "2026-09-03T18:30:00.000Z",
      "cohortId": "current::rollercoaster::C::prompt-r1",
      "candidateCount": 20,
      "placement": 5,
      "facets": {
        "clarity": 3,
        "motionInteraction": 3,
        "composition": 3,
        "craft": 3
      },
      "evidence": [
        "Placed 5 of 20 after comparing initial, automatic, and interaction samples in the same benchmark and level.",
        "Automatic pixel change 70%; interaction change 50.7%."
      ],
      "limitations": [
        "Single provisional multimodal review; independent human confirmation is still required.",
        "Pixel change describes motion magnitude, not motion quality."
      ]
    }
  ]
}
